web-based kidney match raises ethics questions a colorado man who placed a  quot;transplant wanted quot; ad on a massachusetts-based internet site is expected today to receive a kidney donated by a total stranger who simply wanted to do  quot;something big. quot; the transaction marks the first time an organ transplant has been brokered by a commercial web company.,3,wb-based kidney match raises ethics questions a colorado man who placed a  quot;transplant wanted quot; ad on a massachusetts-baed interne site is expected today to receive a kidney donated by a total stranger who simply wanted to do  uot;something big. quot; the transaction marks the first time an organ transplant has been brokered by a commercial we company.,2
"oracle #39;s bid still facing hurdles peoplesoft reiterated on tuesday its opposition to a \$7.7 billion takeover offer from oracle after the european union approved the bid, removing the last regulatory hurdle to a deal.",2,"oracle #9;s id stll facing hurdles peoplesoft reiterated on tueday its opposition to a \$7.7 billion takeover offer from oracle after the european union approved the bid, removing the last regulatory hurdle to a deal.",3
"nextel and sprint in talks on possible merger nextel and sprint are in talks that could lead to a merger between the two mobile phone operators, sources close to the discussions said on thursday.",2,"nxtel and sprint in tals on possible merger nextl and sprint are in alks that could lad to a merger between the two mobile phone operators, sources close to the discussions said on thursday.",3
"dell cuts prices on many corporate products dell on monday said it had cut prices by as much as fifth for a range of products aimed at us corporate customers, as the computer maker passed along savings from cheaper components.",2,"dell cut prices n many corporat products dell on mnday said it had cut prices by as much as fifth for a range of products aimed at us coporate customers, as the computer maker passed along savings from cheaper components.",3
"swing and a miss for asteroid an asteroid the size of a large storage shed came within 4,100 miles of earth this spring, making it the closest near miss ever recorded, us astronomers said this week.",3,"swing and a miss for steroid an aseroid the size of a large storage shed came within 4,100 miles of eart this spring, making it the closest near miss ever recorded, us stronomers said this wee.",1
14 nations to participate in plan to reduce methane thirteen countries agreed yesterday to join a global plan proposed by the bush administration to curb methane emissions by capturing the greenhouse gas and using it as an energy source before it is released into the atmosphere.,3,14 nations to participate i plan to reduce methae thirteen countries agreed yesterday to join a global plan proposed by the bush administration to curb methne emissions by capturing the greenhouse gas and using it as an energy sorce befre it is released into the atmosphere.,0
hornets' davis out with back injury (reuters) reuters - new orleans hornets guard\baron davis is expected to be sidelined one-to-two weeks\because of a lower back injury.,1,hornets' davis out with back ijury (reuters) reuters - ne orlean hrnets guad\baron davis is expected to be sidelined one-to-two weeks\because of a lower back injury.,0
nigeria gives shell \$1.5 billion eco-bill the shell oil company has been handed a \$1.5 billion bill for ecological compensation in the niger delta by the government of nigeria.,2,nigeria ives shell \$1.5 billio eco-bill the sell oil company has been handed a \$1.5 billion bill for ecological comensation in the niger dlta by the government of nigeria.,0
deal has s2io champing at the gigabit ottawa -- a local firm that says it can help shrink backup times at large data centres is growing its business thanks to an alliance with sun microsystems inc.,3,deal has s2io champing at the gigbit ottawa -- a local firm that says it can help shrink bckup times at large daa centres is growing its business thanks to an alliane with sun microsystms inc.,2
profile: leftist vazquez wins uruguay presidential poll uruguay #39;s leftist candidate tabare vazquez won a historic victory in sunday #39;s presidential elections with more than 50 percent of the ballot.,0,profile: eftist vazquez wins uruguay presidential pol uruguay #39;s eftist candidte tabare vazquez won a historic victory in sunday #39;s presidential elections with more than 50 percent of the balot.,1
"students pay more for beer than books british students spend about \$1.8 billion on drink every year, nearly three times as much as they cough up for books, a survey released on monday showed.",2,"students ay more for beer than books british students send about \$1.8 illion on drink every ear, nearly three times as much as they cough up for books, a survey released on monday showe.",0
"cellphones outstrip landlines in india (afp) afp - mobile phone users have outstripped traditional landline connections in india, the government announced.",3,"celphones outstrip landlines in india (afp) afp - moile phone user have outstripped traditional landline connetions in india, the government announce.",0
court to hear microsoft appeal to \$521m eolas ruling a panel of judges on thursday is scheduled to hear microsoft's appeal in a case where a jury ordered the software maker to pay \$520.6 million in damages after finding that internet explorer (ie) infringed on a patent.,3,court to hear microsoft appeal to \$521m eolas ruling a panel of judges on thursday is scheduled to heamicrosofts aappealin a case where a jury ordered the software maker ttopay \$520.6 million in damages after finding that internet eplorer (e) infringed on a patent.,2
tough to predict a hurricane landfall this season #39;s busy season of landfalling atlantic hurricanes has seen a few less-than-perfect calls by tropical ,3,tough to predic a hurricae landfll this season #39;s busy season f landfalling atlantic hurricans has seen a few less-than-perfect calls by tropical ,1
"changes to nigeria union bill the nigerian senate passes a bill  to curb the power of the trade unions, but amends the no-strike clause.",0,"changes to nieria union bill the nigerin sente pases a bill  o curb the power of the trade unions, but amends the no-strike clause.",2
infineon admits conspiracy in dram cartel giant memory company infineon will plead guilty to price fixing of dram chips and will pay \$160 million in fines to the us government.,3,infieon admits conspiracy in ram cartel giant memory company infineon will plead guilty to price fixing of dram chips and will pay \$160 million i fines o te us government.,2
"american economist expected to win nobel (ap) ap - americans have dominated the annual nobel memorial prize in economic sciences five years running, and it may not surprise nobel watchers if the trend continues.",0,"american economist expected to win nobel (a) p - americans have dominated the annual nobel memorial prize in economic sciences five years running, and it may not surprise nobe watches if the trend ontinues.",2
soweto township marks centenary south africa's historic soweto township marks its 100th birthday on tuesday in a mood of optimism.,2,soweto township marks cntenary south africa's historic soweto townshp mrks is 100th birthday on tuesday in a mood of optiism.,0
"stocks climb on drop in consumer prices new york - stocks rose for a second straight session tuesday as a drop in consumer prices allowed investors to put aside worries about inflation, at least for the short term.    with gasoline prices falling to eight-month lows, the consumer price index registered a small drop in july, giving consumers a respite from soaring energy prices...",0,"tocks climb on drop in consumr prices ew ork - stcks rose for a second straight session tuesday as a drop in consumer prices allowed investors to put aside worries about inflation, at least for the short term.    with gasoline prices falling to eight-month lows, the consumer price index registered a small drop in july, giving consumers a respite from soaring energy prices...",2
"aol plans revamp, shake up management - reports the america online unit of time warner inc. (twx.n: quote, profile, research) is reorganizing itself into four operational units to improve decision making, the wall street journal and the washington post reported on tuesday.",2,"aol plans revamp, shake up management - reports the amrica online uni of time warner ic. (twx.n: qote, profile, research) is reorganizing itself into four operational units to improve decision making, the wall street journal and the washington post reported on tuesday.",3
"hawks evicted from new york city perch (ap) ap - pale male the city hawk was evicted from his nest, and the flap has already begun.",3,"hawks evicted from new york city erch (p) a - pale male the city hwk was evicted from his nst, and the flap has already begun.",0
"update 1: negotiators meet at wto for farm talks negotiators met friday at the world trade organization for formal farm talks, capping a weeklong series of informal discussions on ways to reach a wider-ranging liberalization accord by the end of 2005.",2,"upate 1: negotiators meet at to for far talks negotiators met friday at the world trae organization for formal farm talks, capping a weeklong series of informal discussions on ways to reach a wider-ranging liberalization accord by the end of 2005.",0
1994 law designed to preserve guard jobs (ap) ap - a 1994 law strengthened job protections for national guard and reserve troops called to active duty. here are major provisions of the uniformed services employment and reemployment rights act (userra).,0,1994 aw designed to preserve guard jobs (p) p - a 1994 la strengthened job protections for national guard and reserve trops called to active duty. here are major provisions of the uniformed services employment and reemployment rights act (userra).,2
"blurry image might be first picture of exoplanet the image of a blurry red ball near a failed star just might be the first picture ever snapped of a planet outside our solar system, an astronomer who helped find the object said on monday.",3,"blurry image might be first picture of exoplanet the iage of a blurry red ball near a failed star just might be the first pictureever snapped oofa panet outside our olar system, an astronome who helped find the object said on monday.a",1
"security firm justifies virus writer's job securepoint says the alleged sasser author was ""just an immature boy with mindless intent"" who wants to make amends.",3,"ecurity fir justifies vius writer's jo securepoint says the alleged sasse author was ""just an immature boy with mindless intent"" who wants to make amends.",0
"women, and the future of it &lt;strong&gt;interview&lt;/strong&gt; professor wendy hall talks to &lt;em&gt;the reg&lt;/em&gt;",3,"women, and the future of it &lt;strong&gt;intervew&lt;/stron&g; professo wendy hall talks to &lt;em&g;the reg&lt;/em&gt;",0
forecast frosty for u.s.-canadian ties   toronto -- the weather won't be the only thing that's cool when president bush visits neighboring canada next week.,0,forecast frosty for u.s.-anadian tis   toront -- the weather won't be the only thing that's cool when president buh visits neighboring canada next week.,3
"japan loses whale trade bid a un meeting has harpooned a japanese bid to ease curbs on trade in whale products, but a defiant tokyo accused the west of  quot;cultural imperialism quot; and vowed to press efforts to expand whaling.",0,"japa loses whal trade bid a n meeting has harpooned a jpanese bid to ease curbs on trade in hale products, but a defiant tokyo accused the west of  quot;cultural imperialism quot; and vowed to press efforts to expand whaling.",2
fcc says allowing cable tv subscribers to choose their channels &lt;b&gt;...&lt;/b&gt; federal regulators rejected on friday the idea that allowing cable tv subscribers to pay only for channels they want would lower high cable bills.,2,fcc ays allowing cable tv subscribers to choose their channels &lt;b&gt;...&lt;/b&gt; federal egulators rejcted on friday the idea that allowing cable tv subscribers to pay only for channels they want would lower high cable bills.,3
"ibm says its supercomputer is world's fastest  new york (reuters) - international business machines corp.  on wednesday said it has developed the world's fastest  computer, putting it back on top after a japanese supercomputer  claimed the title some two years ago.",3,"ibm says its suprcomputer is world's fastest  new york (reters) - internatinal business machines corp.  on wednesday said it has developed the world's fasest  computer, putting it back on top after a japanese suercomputer  claimed the title some two years ago.",2
"air china main board debut up 6 at hk\$3.15 -2- hong kong (dow jones)--shares of air china ltd. (0753.hk), the country #39;s largest airline, opened 6 higher at their debut wednesday on the hong kong stock exchange #39;s main board.",2,"air china main boar debut up 6 at k\$3.15 -2- hong kong (ow jones)--sares of air china lt. (0753.hk), the country #39;s largest airline, opened 6 higher at their debut wednesday on the hong kong stock exchange #39;s main board.",0
"princess diana fountain to close again (ap) ap - it has been fenced in, clogged with leaves, overrun with visitors and even used as a dog bath. now the princess diana memorial fountain is to close again to replace surrounding grass that has become sodden with splashing water, park officials said tuesday.",3,"princess diana founain to close gain (a) a - it has been fenced in, clogged with leaves, overrun with visitos and even used as a dog bath. now the princess diana memorial fountain is to close again to replace surrounding grass that has become sodden with splashing water, park officials said tuesday.",0
ex-pentagon official gets 9 months for conspiring to favor boeing the former official was sentenced after acknowledging that she had favored the boeing company in pentagon contracts while seeking a job at the company for herself.,2,ex-pentagon official gets 9 months for conspiring to favor being the former official was sentenced after acknowledging tht she had avored the boeng company in pentagon conracts while seeking a job at the company for herself.,0
"fec wants campaign finance decision stayed (ap) ap - federal election officials have asked a judge to stay a ruling striking down several government regulations on political fund raising, arguing that rules interpreting the nation's campaign finance law are crucial as the election approaches.",0,"fec wants campign finance decision stayed (a) a - federal election officials have asked a judge to stay a rulng striking down several government regulations on poitical fund raising, arguing that rules interpreting the nation's campaign finance law are crucial as the election approaches.",2
singapore telecom ties up with malaysia's time dotcom (afp) afp - singapore telecommunications (singtel) said it has entered into an agreement with malaysia's time dotcom to link their corporate customers through private leased line circuits.,0,singapore telecom tie up with malaysia's time dotcom (fp) fp - ingapore telecommunications (singtel) sid it has entered into an agreement withwithamalaysia'setimecom to link their corporate customers through private leased line circuits.,2
"album-on-a-card p2pnet.net news:- if you #39;re in britain and you see people peering intently at their mobile phones, tapping their feet and snapping their fingers at the same time, they might be checking out the new robbie williams greatest hits album.",3,"albu-on-a-card p2pnet.net nws:- if you #39;re in britain and you see people peering intently at their mobil phoes, tapping their feet and snapping their fingers at the same time, they might be checking out the new robbie williams greatest hits abum.",2
"another homicide in holland  it is a sad day.      in what seems to be another politically inspired homicide in holland, dutch filmmaker, and controversial columnist theo van gogh was brutally murdered in the streets of amsterdam this morning.",0,"another homicide in holland  it is a sad day.      in what seems to be another politically inspired homicide in holland, dutc filmmaker, and contoversial columnist theo van ogh was brutally murdeed in the streets of amsterdam this moning.",2
"pota #39;s dead, terror teeth remain new delhi: the ordinances to repeal the stringent anti-terror law, pota, and amend an existing law to provide teeth to it to tackle terror received presidential assent on tuesday night.",0,"pota #39;s dead, terro teeth remain new deli: the ordinances to repeal the stringent anti-terror law, pota, and amend an existing law to provide teeth to it to tackle teror received presidentia assent on tesday night.",3
"robo-servants set to sweep into homes millions of new robots will be installed in households over the next few years, a un report predicts.",3,"robo-servants set to swee ino homes millions of new robts ill be installe in households over the next few years, a un report predicts.",0
transport strike hits netherlands public transport grinds to a halt in the netherlands as workers strike against the government's planned welfare cuts.,0,transport strike hits netherlands pblic transport grinds to a halt in the netherlands a workers strike against the government's planne welfar cuts.,2
"dyke reopens wmd row former bbc chief greg dyke has reopened the row over tony blair #39;s decision to go to war with iraq. dyke was forced to resign from his post, along with former bbc chairman gavyn davies, last january after lord ",0,"yke reopens wd row former bb chief greg dyke has reopened the row over tony bair #39;s decision to go to war with ira. dyke was forced to resign from his post, along with former bbc chairman gavyn davies, last january after lord ",2
"cu athletic director dick tharp resigns (ap) ap - colorado athletic director dick tharp resigned monday, ending a nine-year tenure sullied by accusations of recruiting violations and fiscal mismanagement.",1,"u athletic director dick tharp resigns (ap) ap - coloado aathletcidirectoridickharp resigned monday, ending a nie-year tenure sullied by accusations of recruiting violations and fiscal mismanagement.",0
"ibm: blue gene supercomputer for sale fresh after taking the performance crown and capping a five-year, \$100 million r amp;d effort, ibm today announced that blue gene is officially going on sale with a starting price of \$1.",2,"ibm: ble gene supercomputer for sale fresh afer takng the performance crow and cappin a five-year, \$100 million r amp;d effort, ibm today announced that blue gene is officially going on sale with a starting price of \$1.",3
poll cost us victory - cech referee graham poll came under renewed fire today as goalkeeper petr cech blamed him for costing chelsea victory at highbury by allegedly reneging on a promise to blow his whistle before thierry henrys free-kick.,1,poll cost us victory - cech referee graham poll came unde renewed fire today as goalkeper petr cch blamed him for costing chesea victory at higbury by allegedly reneging on a promise to blow his whistle before thierry henrys free-kick.,0
"scandal won #39;t go away athens -- it was telling yesterday that the majority of the dozens of journalists who asked questions and attended a news conference into a greek doping scandal were mostly canadian. question after question came from canadians. we were all there, i think, ...",1,"scandal won #9;t go away ahens -- it was telling yesterday that the majority of the dozens of journalists who asked questions and attended a news conference nto a grek dopin scandal were mostly canadian. question after question came from canadians. we were all there, i think, ...",0
blog that #39;s the most look-ed up world on merriam-webster #39;s &lt;b&gt;...&lt;/b&gt; a four-letter term that came to symbolise the difference between old and new media tops us dictionary publisher merriam-webster #39;s list of the 10 words of the year.,2,blog that #39;s the most look-ed up world on merriam-webster #39;s &lt;b&gt;...&lt;/b&gt; a four-letter tem that came to symbolise the difference between old and new media tops us dictionary publsher merriam-webster #39;s list of the 10 words of the year.,3
"britain ups anti-terror security spending (ap) ap - the sept. 11 attacks on america forced prime minister tony blair's government to ponder a troubling question: could terrorists pull off something similar, or even worse, in london or another big british city? the answer, they concluded, was yes.",0,"britan ups ati-terror security spending (p) p - the sept. 11 attacks on america forced prime minister tony blair's government to ponder a troubling question: could terrorists pull off something similar, or even worse, in london or another big brtish city? the answer, they concluded, was yes.",3
needham downgrades apple on valuation new york (dow jones/ap) -- apple computer inc. shares fell friday after needham  amp; co. downgraded the stock to hold #39; #39; from buy.,2,needham dowgrades apple on valuation new yok (dw jones/ap) -- apple computer inc. shares fell friday after eedham  ap; co. downgraded the stock to hold #39; #39; from buy.,3
skyboxes may reach a limit verizon communications inc. would seem to be a prime candidate to snap up a luxury suite at the \$440 million ballpark being planned for washington's major league baseball team.,2,skyboxes may reach a limit verzon communicatins nc. would seem to be a prime candidate to snap up a luury sute at the \$440 million ballpark being planned for washington's major league baseball team.,1
"nobel economics prize awarded norwegian-born finn kydland and edward prescott of the united states won the 2004 nobel\economics prize, the royal swedish academy of sciences said on monday.",0,"noel ecnomics prize awarded norwegian-born finn kydland and edward prescott of the united states won th 2004 obel\econoics prize, the royal swedish academy of sciences said on monday.",3
"no tax on internet access until at least 2007 consumers won #39;t have to pay a tax to log on to the internet until at least 2007, after congress voted friday to renew a recently lapsed ban on internet taxation.",3,"no tax o interne access until at least 2007 consumers won #39;t have to pay a tax to log on to the internet until at least 2007, after congress voted friday to renew a recently lapsed ban on iternet taxatio.",2
"health insurance costs soar, workers hit (reuters) reuters - health insurance premiums rose five\times faster than u.s. workers' salaries this year, according\to a survey released on thursday that also showed slippage in\the percentage of american workers covered by employer health\plans.",2,"health insurane costs soar, workers hit (reuters) reuters - health insuranc prmiums ose five\times faster than u.s. workers' salaries this year, according\to a survey released on thursday that also showed slippage in\the percentage of american workers covered by employer health\plans.",3
"labour has failed on pensions, commission will report a report on pensions commissioned by the government will be highly critical of labour #39;s record on the issue, saying that people are saving far less for retirement than official figures show ",2,"labour has failed on pensios, commission will report a report on ensions commissioned by the government will be highly critical of labour #3;s record on the issue, saying that people are saving far less for reirement than official figures show ",0
"daily mail hits back at blunkett the daily mail today dismissed david blunkett #39;s claim that the media played a role in his downfall, saying he only had himself to blame.",0,"daily mail hits back at blunktt the daily mail today dismissed david blukett #39;s claim that the media played a role in his ownfall, saying he only had hmself to blam.",3
"china trade volume to reach \$1.1trillion in 2004 china #39;s total trade volume will reach 1.1 trillion us dollars in 2004 -- up 30 percent over 2003 --with a trade surplus of about 10 billion us dollars, said assistant minister of commerce yi xiaozhun.",2,"china trade volume to reach \$1.1trillion in 2004 china #39;s ttal trade volume will reach 1.1 trillion u dollars in 2004 -- up 30 percent over 2003 --with a rade surplus of about 101billion u dollars, said assistant minister of commrce yi xiaozhun.",3
"exeter uni cans chemistry department in a move that has been dubbed as  #39;disastrous #39; by the royal society of chemistry, exeter university is to drop the teaching of chemistry as a subject.",3,"exeter uni cans cemistry department in a move that has been ubbed as  #39;disastrous #39; by the royal society of chemisry, exeter univrsity is to drop the teaching of chemstry as a subject.",2
bond report chicago (cbs.mw) - treasurys remained solidly lower wednesday in the wake of election results that had president bush ahead of democratic challenger john kerry.,2,bon repot hicago (cs.w) - treasurys remained solidly lower wednesday in the wake of election results that had president bush ahead of democratic challenger john kerry.,0
"toys will be toys trust me, you don #39;t want to see desperate parents shopping over the holidays. i was at circuit city (nyse: cc) last week and saw a mother pleading with a sales clerk for a nintendo ds portable video game system.",3,"toys will be toys trust me, you don #39;t want to see desperate parents shopping over the holidays. i was at circuit city (nyse: cc) last week and saw a mother pleading with a sales clerk for a nntendo d prtable vide gae system.",2
