"porn processor settles deceptive-billing charges  washington (reuters) - a pornography bill-processing  company has agreed to forego \$17 million that it billed  computer users in order to settle deceptive-business charges,  the u.s. federal trade commission said on monday.",3,"orn prcessor settles deceptive-billing charges  washington (reuters) - a ponography bill-processing  company has agreed to forego \$17 million that it billed  computer users in order to settle deceptive-business charges,  the u.s. federal trade commission said on monay.",2
"nasa leader cites finances and submits his resignation sean o #39;keefe resigned as nasa administrator on monday, saying he is leaving the position he has held for three years to pursue better economic opportunity for his family.",3,"asa leader cites finances and submits his resignation san o #39;keefe resigned as nsa adminitrator on monday, saying he is leaving the position he has held for three years to pursue beter economic opportunity for his family.",2
utc buys kidde for 1.4bn uk fire equipment manufacturer kidde agrees a 1.4bn takeover by us manufacturer united technologies.,2,utc bys kidde fo 1.4bn uk fie equipment mnufacturer kidde agrees a 1.4bn akeover by us manufacturer united technologies.,3
"stocks lower as oil prices steam higher with the much-ballyhooed initial public offering of google behind them and oil chugging to a new record high, investors took a step back today.",2,"tocks lower as il prices steam higher with the much-ballyhooed initial pubic offering of google behind them and oi chugging to a new record high, invetors took a step back today.",3
"lockheed martin led group wins 3 billion dollar us postal service &lt;b&gt;...&lt;/b&gt; owego, united states : a group of technology and telecommunications heavyweights led by lockheed martin corp has won a potential three billion dollar contract from the us postal service to revamp its vast data communication networks, lockheed martin said.",2,"lockheed martin led group ins 3 billion dllar u postal srvice &lt;b&gt;...&lt;/b&gt; owego, unitd states : a group of technology and telecommunications heavyweights led by lockheed martin corp has won a potential three billion dollar contract from the us postal service to revamp its vast data communication networks, lockheed martin said.",3
sony and samsung to cross-license patents sony corp. and samsung electronics said on tuesday they had agreed to share patents on basic technology to speed up product development and avoid adding to a growing number of cross-border patent disputes.,2,sony and samsung to cross-license patents sony cor. and samsung electrnics said on tuesay they had agreed to shre patents on basic technology to speed up product development and avoid adding to a growing number of cross-border patent isputes.,3
"warren tones down his bark  #39; #39;the views of the host do not necessarily reflect the views of the station or its sponsors. #39; #39;. the browns were not thrilled when warren said he would gladly pay a \$50,000 fine to rub out roethlisberger, who ",1,"warren tones down his bark  #39; #39;the views of the host do not necessarily reflect the views of the station or its sposors. #9; #39;. the brwns were not thrille when warren said he would gladly pay a \$50,000 fine to rub out roethlisbeger, who ",3
tivo loss widens san francisco (cbs.mw) - tivo said its second-quarter loss widened from a year earlier on higher customer acquisition costs. free!,2,tivo los widens an franciso (cb.w) - tivo said its second-quarter loss widened from a year earlier on higher customer acquisition costs. free!,3
"toshiba claims hollywood backing in war for next dvd standard (afp) afp - toshiba said four major hollywood studios had thrown their crucial weight behind high definition dvd (hd-dvd), one of two disc formats contending to be the standard in next-generation dvds.",3,"toshiba claims hollywood backing in war for next dvd standard (afp) afp - toshiba said four major hollywood studios had thrown their crucial weight behind high dfinition dv (h-dv), one of two disc fomats contending to be the standard in next-generation dvds.",0
uk to take tougher line on ultrawideband report for british regulator calls for wireless technology to be more strictly controlled than in united states.,3,u to take tougher lne on ultrawideband report for british regulator calls fo wireess techology to be more strictly controlled than in united states.,0
collingwood anchors england (afp) afp - paul collingwood's unbeaten 80 took england to 299 for seven against zimbabwe in their opening champions trophy pool d match at edgbaston here.,0,collingwood anchors enland (af) af - paul collingwood's nbeaten 80 took england t 299 for seven against zimbabwe in their opening champions trophy pool d match at edgbaston here.,1
"no kashmir breakthrough new delhi, 7 september 2004 - india and pakistan stuck to their guns on the kashmir issue as the foreign ministers of the two countries concluded their talks yesterday on what was described as a positive note.",0,"no kashmi breakthrough ew delhi, 7 september 2004 - india and pakista stuck to their guns on the kashmi issue as the foreign ministers of the two countries concluded their tals yesterday on what was described as a positive note.",2
"times to scrap broadsheet edition the times is to scrap its broadsheet edition and go tabloid from monday, it was confirmed today. the decision was made after a trial run of the compact edition proved a success, said editor robert thomson.",3,"times to scrap bradsheet editio the times is to scrap its broadsheet edtion and go tabloid from monday, it was confirmed today. the decision was made after a trial run of the ompact editin proved a success, said editor robert thomson.",2
"iliadis, tanimoto win judo golds ilias iliadis of greece thrilled the home crowd tuesday, beating roman gontyuk of ukraine to win the gold medal in the 81-kilogram class. ",0,"iliadis, tanimoto win udo gods ilias iliadis of greec thrilled the home crow tuesday, beating roman gontyuk of ukraine t win the gold medal in the 81-kilogram class. ",1
"scansoft to acquire 3 software firms scansoft inc. said it plans three acquisitions. the company will acquire phonetic systems ltd., a provider of automated directory assistance and voice-based programs, for \$35 million in cash, and an additional consideration of up to \$35 million, based on the achievement of performance targets and the potential vesting of a warrant to buy 750,000 common shares. art advanced recognition technologies ...",3,"scansoft to acquire 3 softwae firms scansoft inc. said it plans three acquisitions. the company will acquire phonetic systems ltd., a prvider of automated diretory assistance and voce-based programs, for \$35 million in cash, and an additional consideration of up to \$35 million, based on the achievement of performance targets and the potential vesting of a warrant to buy 750,000 common shares. art advanced recognition technlogies ...",2
"reality tv show follows the unfaithful (reuters) reuters - two emmy-nominated\reality producers are developing a series about infidelity,\featuring stories of unfaithful spouses who have turned to a\popular online matchmaking service that caters to attached\people seeking extramarital affairs.",3,"realty t show follows the unfaithful (reuters) reuters - tw emmy-nominated\realit producers are developing a series about infidelity,\featuring stories of unfaithful spouses who have turned to a\popular oline matchmaking service that caters to attached\people seeking extramarital affairs.",2
"intel defeats amd in court amd #39;s attempt to persuade the us court to sanction the release of over 60,000 pages of intel documentation to a european commission anti-trust enquiry has failed.",3,"inte defeats amd in court md #39;s attempt to persuade the us court to sanction the releas of over 60,00 pages of intel documentation to a european commission anti-trust enquiry hs failed.",2
"bourses set for losses after wall st falls (ft.com) ft.com - european equity markets were poised for opening losses on thursday following a weak session on wall street overnight, while caution was likely ahead of results from nokia, the leading mobile handset maker.",2,"bourses set for losses after wall t falls (ft.com) ft.com - european equity markets were poised for opening losses on thursday following a weak sesion on wall street overnight, while caution was likely ahed of results from nokia, th leading mobile handset maer.",3
"boys 'cured' with gene therapy  gene therapy can cure children born with a condition that knocks out their natural defences against infection, mounting evidence shows.",3,"boys 'cured' with gene therapy  ene therapy can cure children brn with a cndition that nocks out their ntural defences against infection, mounting evidence shows.",0
"biggest threat to britain #39;s grand prix heritage henry ford once said that his factories didn #39;t make cars,  quot;they make money. quot; it is a philosophy bernie ecclestone would surely understand more than most after his surgically dispassionate decision yesterday not to include the british grand prix on the ",1,"biggest threat to britan #39;s grand pri heritage henry ford once said that his factories didn #39;t make cars,  quot;they make money. quot; it is a philosophy bernie ecclestoe would surely understand more than most after his surgically dispassionate decision yesteday not to include the british grand prx on the ",2
decaying pig corpses reveal forensic secrets (reuters) reuters - decaying pig corpses deposited\in secret locations around london are providing scientists with\forensic information that may help them solve crimes.,3,decaying ig corpse reveal fornsic secret (reuters) reuters - decaying pig corpses deposited\in secret locations around london are providing scintists with\forensic information that may help them solve crimes.,0
aisin finishes deal for michigan land handy township -- a japanese auto supplier said thursday it completed the purchase of about 750 acres of michigan land for a proving ground.,2,aisin finishes deal for michigan land handy township -- a japanese aut suplier said thursday it completed the purchase of about 750 acres of michigan and for a proving groud.,1
toyota to open south china plant japan carmaker toyota enters a joint venture to produce saloon cars in southern china.,2,tyota to open south china pant japan carmakr tyota enters a joint ventue to produce saloon cars in southern china.,0
"french internet provider wanadoo will build dutch broadband network (afp) afp - the french internet provider wanadoo will construct its own broadband network in the netherlands and hopes to reach 55 percent of dutch homes, a spokesman told the financieele dagblad.",3,"french internet provider wanadoo will build dutch broadbad network (afp) afp - the ffrenchiintrnetrprovidernadoo will construct its own brodband network in the netherlands and hopes to reach 55 percent of dutch homes, a spokesman told the financieele dagblad.",0
"inaction #39;s consequence last month the united states and its allies signaled a change in sudan policy. rather than pressuring sudan #39;s government to halt its genocidal attacks against civilians in the western province of darfur, they ",0,"inaction #39;s consequence last month the united states and its alles signaled a change in suda policy. rather than pressuring suda #39;s government to halt its genocidal attacks against civilans in the western province of darfur, tey ",2
"world awaits chinese grand prix a quarter of a billion dollars to build the track. tens of millions in racing fees. more than 150,000 live spectators and a television audience of hundreds of millions.",1,"world awaits chinese grnd pix a quarter of a billion dollars to build the track. tens of millions i rcing fees. more than 150,000 live spectatrs and a television audience of hundreds of millions.",0
"august chip sales growth slows on high inventory  san francisco (reuters) - global semiconductor sales growth  slowed to 1 percent in august as electronics makers reacted to  growing inventories in asia by limiting orders of chips, an  industry trade group said on thursday.",2,"august chip sales rowth slos on high inventory  san fracisco (reuters) - global semiconductor sales growth  slowed to 1 percent in august as electronics makers reacted to  growing inventories in aia by limiting orders of chips, n  industry trade group said on thursday.",3
"one assist, goal for hometown star stockholm, sweden -- first, peter forsberg watched as his retired jersey no. 21 was lowered from the rafters at kempehallen. then, after getting a standing ovation from the sold-out crowd, the locked-out colorado ",1,"one assist, goa for hometown star stockholm, sweden -- first, peter forsberg watched as his retird jersey no. 21 was lowered from the rafters at kempehallen. then, after geting a standing ovaaton ffromthe sold-out crod, ththeocked-out colorao ",0
"samsung plans to invest won25,000bn in chips samsung electronics, the world #39;s second largest computer chip manufacturer, yesterday said that it would invest won25,000bn (\$24bn) in its semiconductor business by 2010 to generate ",3,"samsun plans to invest won25,000bn in chip samsug electronics, the wold #39;s second largest computer chp manufacturer, yesterday said that it would inveinvest25,000bn (\$24bn) in its semiconductor business by 2010 to generate ",2
"alternative energy: ready or not? even with a boost from higher oil prices and growing concern about global warming, the payoff on most alternative energy technologies seems a ways off.",2,"alternative energy: ready or not? even with a boost from higher il prces and growing concern about gloal warming, the payof on most alternative energy technologies seems a ways of.",3
"so you think you get a lot of e-mail singapore -- if you didnt think anybody else could possibly get any more spam than you, then think of bill gates. the microsoft corp.",3,"so you think you get a lot of e-mal singapore -- if you didnt think anybody else could possibly get any more spa than you, then think of bill gaes. the microoft corp.",2
greenspan issues new warning over us current account deficit (afp) afp - us federal reserve chairman alan greenspan said the united states' huge current account deficit cannot be indefinitely financed by foreign countries and investors.,2,reenspan issues new warning over u current accunt eficit (afp) afp - us federal reserve chairman alan reenspan said the united states' huge current account deficit cannot be indefinitely financed by foreign countries and investors.,0
cricket: dubai global academy the international cricket council are to open a global cricket academy designed to improve standards of lesser nations.,0,cricket: dubai global academy the international cricket council ae t open a global cricket acadey designe o improve standards of lesser nations.,1
"petherick delighted over franklin hat trick peter petherick welcomed james franklin into the test hat trick club with open arms last night. the former offspinner, who took his hat-trick on debut against pakistan in lahore 28 years ",1,"petherick delighted over franklin hat trick peter petherick welcomed jmes franklin into the tet hat trick club with open arms las night. the former offspinner, who tok his hat-trick on debut aganst pakistan in lahore 28 years ",0
keep it in the family the irs is gunning for your inherited ira. follow these steps to avoid costly penalties.,2,keep it in the family te ir i gunning for yur inherited ira. follow these steps to avoid costy penalties.,0
"conte goes on tv and names names as the bassist for the pop-funk band tower of power, victor conte laid down a song #39;s backbone by playing a predetermined series of notes.",0,"conte goes on v and names names as the bassist for the po-funk band tower of power, victor conte lid down a sog #39;s backbone by playing a predetermined series of notes.",1
"slowing population 'lacks funds' rich countries are giving only half the amount they promised to help to slow world population growth, the un says.",2,"sloing population 'lacks funds' rih countries are giving only alf the mount they promised to help to slow world poppopulationoth, the un says.",0
perry oks money for aps as more accusations arise the state #39;s adult protective services agency will get an emergency infusion of \$10 million to correct the kinds of problems that have arisen in el paso.,2,perry ok oney for aps as more accusations arise he state #3;s adult protective service agency will get an emergency infusion of \$10 million to correct the kinds of problems that have arisen in el paso.,3
"corning begins work on taiwan lcd facility encouraged by the demand for lcds, glass maker corning on thursday said it has broken ground for a second manufacturing facility in taiwan.",3,"corning begins work on taiwa lc facility encouraged by the demand for lds, glass maker corning on thursday said it has broken ground fr a scond manufacturing facility in taiwan.",2
"microsoft signs two indian deals microsoft is to form multi-million pound partnerships with two indian software firms, and is expected to double the 1,500 people it already employs in india.",3,"microsof signs two indian deals microsoft is to form multi-million pound partnerships with two indian software firms, and is expected t double the 1,500 people t alrady employs n india.",2
one dead in romanian bear rampage a brown bear kills one person and wounds several in the transylvanian forests of romania.,0,one dea in omanian bear rampag a brown bear kill one person and ounds several in the transylvanian forests of romania.,3
"eu increases pressure for rights in myanmar eu foreign ministers agreed monday to tighten sanctions against myanmar if it does not improve its human rights record by oct. 8, when an eu meeting with asian countries starts in vietnam.",0,"eu increases pressure for rights in yanmar eu foreign minisers agreed monday to tighten sanctions against myanma if it does not improve its huan rights record by oct. 8, when an eu meeting with asian countries starts in ietnam.",2
"models replace ball boys at madrid masters fashion models replaced traditional ball boys in the biggest surprise monday at the madrid masters, where expected winners included albert costa, alex corretja and luis horna.",1,"models replace ball boys at madrd maters fashion models replaced traditional ball boys in the biggest surpris moday at the adrid masters, where expected winners included albert costa, alex corretja and luis horna.",3
"contradiction in terms : how to make beer it's been around for thousands of years. it has been worshiped, reviled, banned, and made the cornerstone of economies. it has helped us celebrate, weep, relax, and get laid. and now we're going to make some. a pint, a glass, an ale, a lager, a beer.",2,"contradiction in terms : how to make beer it's been around for thousands of years. it has been worshiped, reviled, banned, an made the cornerstone o eonomies. it has helpe u celebrate, weep, relax, and get laid. and now we're going to make some. a pint, a glass, an ale, a lager, a beer.",0
"vioxx should have been recalled in 2000 merck  amp; co inc. should have pulled the arthritis drug vioxx off the market in 2000, because there was enough evidence that showed it was associated with an increased heart attack risk, according to researchers.",2,"vioxx should have been recalled in 2000 merc  ap; co in. should have pulled the arthritis drug vioxx off the market in 2000, because there was enough evidence that showed it was associated with an increaed heart attack risk, according o researchers.",3
"for neglected video, a hollywood touch a growing cottage industry is taking customers' raw home video and putting it on dvd, in some cases producing short movies with sophisticated cinematic effects and a musical soundtrack.",3,"for neglected vido, a hollywood touch a growing cottage industry is taking custoers' raw home vido and putting it on dd, in some cases producing short movies with sophisticated cinematic effets and a musical soundtrack.",2
"minutemen ko'd by dukes harrisonburg, va. -- opposing running backs are beginning to enjoy playing against the university of massachusetts.",3,"minutemen ko'd y dukes harrisonburg, va. -- opposing running backs re beginning to enjoy playing against the unversity f massachusett.",0
"hamm flap, dream team just wrong athens, greece -- look at it this way: at least the us basketball team won #39;t be asked to give back its gold medal. on a day that was olympic in scope both for its shock value and its intrinsic weirdness, the ",1,"hamm flap, dream team just wrong athens, greece -- lok at t this way: at least the us basketball team won #9;t be asked to give back its gold medal. on a day that was olympic in scope both for its shock value and its intrinsic weirdness, te ",0
"lcc int #39;l posts 3q profit, shares tumble lcc international inc., which offers wireless voice and data technical consulting, on monday saw shares plummet as much as 12 percent in after-hours trade after the company swung to a third-quarter profit but predicted lower revenues are ahead.",2,"lcc int #39;l posts q pofit, sares tumle lcc international in., which offers wireless voice and data technical consulting, on monday saw shares plummet as much as 12 percent in after-hours trade after the company swung to a third-quarter profit but predicted lower revenues are ahead.",3
"asian shares hit by metals tumble, oil (reuters) reuters - a sharp slide in global metals\markets hammered industrial and mining stocks such as jfe\holdings and bhp billiton thursday, while oil prices crawled\back toward record highs.",2,"asian sares hit by mtals tumble, oil (reuters) reuters - a shar lide in global metals\markets hammered industrial and mining stocks such as jfe\holdings and bhp billiton thursday, while oil prices crawled\back toward record highs.",0
jfk killing fades in intensity washington: the 41st anniversary of president john f kennedy #39;s assassination passed on november 22 - a lot more quietly than earlier ones.,0,jf killig fades in intensity washington: the 41s annivesary of president john f kennedy #39;s asassination passed on november 22 - a lot more quietly than earlier ones.,2
"asia-europe forum grows, myanmar irritates  hanoi (reuters) - an asia-europe forum accepted myanmar and  12 other new members on thursday ahead of a summit strained by  yangon's human rights record and detention of democracy icon  aung san suu kyi.",0,"asia-europe forum grows, myanmar irritates  hnoi (reuters) - an asia-europe forum accepted mmyanmarand  12 other new members on thursday ahead of a summit strained by  yangon's human rights record and detention of democrac icon  ang san su ky.",3
"sec chief lashes out at reform opponents washington -- too many business interests are clinging to a failed status quo and resisting necessary governance reforms, the government #39;s top securities regulator said thursday.",2,"ec chief lashes out a reform opponents washington -- too many busines interests are clinging to a failed status quo and resisting necessary governance reforms, the government #39;s top ecurities regultor said thursday.",0
"ati shares resources with hypermemory graphics chipmaker ati (quote, chart) unveiled a new technology it said lets its visual chips share system memory for graphics processing.",3,"at shares resources with hypermemory graphics chipmaker ati (quote, chart) unveled a new technology it said ets its visual chis share syste memory for graphics processing.",2
dodge denies copps charge that martin wanted to scrap canada health act (canadian press) canadian press - ottawa (cp) - add the governor of the bank of canada to the list of people who say sheila copps has a faulty memory.,0,dodge denies copps charge that martin wanted to scrap caada health act (canadan prss) caadian pres - ottawa (cp) - add the governor of the bank of canada to the list of people who say sheila copps has a faulty memory.,2
"microsoft, eu officials in procedure meeting microsoft (quote, chart) and representatives of the european union #39;s competition commission will sit down at the table together on thursday, but it won #39;t be to eat.",2,"microsoft, e officils i procedure meetng microsoft (quot, chart) and representatives of the european union #39;s competition commission will sit down at the table together on thursday, but it won #39;t be to eat.",3
"microsoft browser market share slips slightly microsoft corp. #39;s (msft.o: quote, profile, research) share of the browser market slipped slightly in recent months but still dominated with 92.",3,"microoft brower market share slips slightly micrsoft corp. #39;s (msft.o: quote, profile, research) share of the browsr market slipped slightly in recent months but till dominated with 92.",2
amazon leaves jungle business the company has no further expansion plans after buying a chinese website. also: virgin joins quest for a better ipod   hellip;. peoplesoft makes promise that oracle will live up to   hellip;. and more.,2,amzon leaves ungle business the company has no further expansion plans after buying a chinese website. also: virgin joins quest for a better ipod   hellp;. peoplesoft makes promise that oracle will live up to   helip;. and mor.,3
"dems, gop: who's got the brains? well, both do, actually. but there are some discernible differences in brain activity which may just explain why a democrat sees the world one way, and a republican sees it another.",0,"dem, op: who's got the brains? well, both do, actually. but there are some discernible differences in brain activity which may just explain why a democrat sees the world one way, and a repulican sees it nother.",3
