"olympic traffic measures needed at paralympics: experts experts recommend that the traffic control measures taken during last month #39;s olympic summer games and the current paralympics should be kept in athens permanently, as they ",1,"lympic traffic measures needed at paralympics: experts experts recommend that the traffic control measures taken during last month #39;s lympic summer games and the current paralmpics should be kept in athen permanently, as they ",3
california group sues albertson's over privacy concerns a california-based privacy advocacy group is suing supermarket giant albertson's over alleged privacy violations involving its pharmacy customers.,3,california group sues albertson's over priacy concerns a california-based pivacy advocacy grou is suing supermarket giant albertson's over alleged priacy violations involving is pharmacy customers.,2
"microsoft closes hotmail to outlook and outlook express users from today, new users of microsoft #39;s outlook and outlook express won #39;t be able to view hotmail emails for free. the company has announced that in future the service will only be available to subscribers of the msn premium services costing \$19.",3,"microoft closes hotmail to outlook and outlook express users from today, new uers of mcrosoft #39;s outlook and outlook express won #39;t be able to view hotail emails for free. the company has announced that in future the service will only be available to subscribers of the ms premium services costing \$19.",2
dino sucked in prey with its giraffe neck the fossil of a sea reptile with a neck twice as long as its body is solving the mystery of how some ancient reptiles used such unusually long appendages.,3,dio sucked in pry with its giraffe neck the fossl of a sea reptle wiwith neck twice as long as ititsody is solving the mystery of how some ancient repiles used such unusually long appendages.,0
"qantas wants better tax treatment mark colvin: qantas might have posted yet another record profit, but the national carrier #39;s boss, geoff dixon, claims earnings are being hampered by unfair subsidies for international carriers allowed to fly in and out of australia. ",2,"qantas wants better ax treatment mark colvin: qantas might have posted yet another record profit, but the national carrier #39;s boss, geoff dixon, claims arnings are being hampered y unair subsidie for international carriers allowed to fly in and out of australia. ",3
closing ceremonies host city athens bid a final farewell to the athletes and guests of the 2004 summer games with a spectacular party under a full moon.,1,closing ceremonies ost ciy athen bi a inal farewell to the athletes and guests of the 2004 summer games with a spectacular party under a full moon.,0
"ky. company wins grant to study peptides (ap) ap - a company founded by a chemistry researcher at the university of louisville won a grant to develop a method of producing better peptides, which are short chains of amino acids, the building blocks of proteins.",3,"ky. company wins grant to stdy peptides (p) a - a company founded by a chemstry researher at the university of louisville won a grant to develop a method of producing better peptides, which are short chains of amino acids, the building blocks of proteins.",2
"pm to discuss strategic partnership prime minister manmohan singh arrived on tuesday for the first major diplomatic foray that includes talks with us president george w bush, pakistan president pervez musharraf and address to the un general assembly.",0,"pm to discuss strategic partnership prime minister manmohan singh arived on tuesday for the first major diplomtic foray that includes talks with us president george w bush, pakistan president pevez musharaf and address to the un general asembly.",2
"lockheed to launch rocket; boeing gets new date (reuters) reuters - lockheed martin corp. on monday\announced that it will launch its atlas v rocket on dec. 17 as\planned, while boeing co. waited to reschedule a launch of its\delta iv heavy-lift rocket that it was forced to abandon on\sunday.",3,"lockhed to aunch rocket; boeing gets new date (reuters) reuters - lockhee marti corp. on monday\announced that it will lunch its atlas v rocket on dec. 17 as\planned, while boeing co. waited to reschedule a launch of its\delta iv heavy-lift rocket that it was forced to abandon on\sunday.",0
"siemens in 2.69bn deal with bbc german industrial giant siemens has signed a 2.69bn contract to deliver technology services around the world to the bbc, a deal that will see it acquire the broadcasters technology subsidiary.",3,"sieens in 2.69bn deal with bb germn ininstrial giant siemens has signed a 2.29bn contract to deliver technoloy services around the world to the bbc, a deal that will see it acquire the broadcasters technolog subsidiary.",2
"steal spongebob, buy a pc museum we've got two more entries this week in the category of ""what weird, useless stuff is for sale on ebay that i just have to have?""",3,"teal spongebob, buy a c museum we've got two more entries this week in the caegory of ""wha weird, useless stuff is for sale on bay that i just have to have?""",2
"in taipei, talk of arms -- and amity premier yu shyi-kun hopes economic ties to the mainland will guarantee peace. if not,  quot;taiwan has to have to ability to defend itself quot;.",2,"in taipei, talk o arms -- and amity premir yu shyi-kun hopes eonomic ties to the mainlanandill garantee peace. if not,  qot;taiwan has to have to ability to defend itself quot;.",0
"card fraud unit nets 36,000 cards in its first two years, the uk's dedicated card fraud unit, has recovered 36,000 stolen cards and 171 arrests - and estimates it saved 65m.",3,"car raud uit nets 36,000 cads in its first two years, the uk's dedicated cad fraud unit, has recovered 36,000 stolen cards and 171 arrests - and estimates it saved 65m.",2
the great vegetarian scam ive written before about my struggle to remain a vegetarian on tuesday - when i abjure meat for religious reasons -hile travelling.,0,the great vegetarian scam ive ritten before about my struggle to remain a vegetarian on tuesdy - when i abjure meat for eligious reasons -hile travalini.,3
"hurricane center #39;s projection on charley not far off, data show fort lauderdale, fla. - (krt) - despite criticism that it should have better anticipated hurricane charley #39;s rapid intensification and quick turn, the national hurricane center #39;s forecast wasn #39;t that far off, a preliminary post-mortem shows. ",2,"hurricane center #39;s projection n charey ot far off, data sho for lauderdale, fla. - (krt) - despite criticism that it should have better anticipated hurricane charley #39;s rapid intensification and quick turn, the national hurricane center #39;s forecast wasn #39;t that far off, a preliminary post-mortem shows. ",3
"google unveils scholar search tool jacksonville, fl -- the online search engine leader google has unveiled a new tool for scholarly research. the new service is aimed at making better sense of all the scholarly work stored on the web and it ",3,"googl unveils scholar search tool jacksonville, fl -- the online search enine leader google has unveiled a new tool for scholarly research. the new servic is aimed at making better sense of all the scholarly work stred on the eb and it ",2
"will itunes ever make a lot of money for apple? on its latest earnings call (7/14/04), a question was asked about the profitability of itunes, and management responded by stating that it made just a small profit.",3,"will ituns ever make a ot of money or appe? on its latest earnings call (7/14/04), a question was asked about the profitability of iunes, and management responded by stating that it made just a small profit.",2
"us may have new case of mad cow disease  washington (reuters) - a final test is likely to confirm a  second u.s. case of mad cow disease, experts said on thursday,  though they see a small possibility the animal, which tested  ""inconclusive"" in two preliminary tests, could be given a clean  bill of health.",2,"s ay have new case of mad cw disease  washinton (reutrs) - a final test is likely to confirm a  second u.s. case of mad cow disease, experts said on thursday,  though they see a small possibility the animal, which tested  ""inconclusive"" in two preliminary tests, could be given a clean  bill of health.",3
"ipod plus photo-viewing now it looks as if an additional function, coupled with a definitely major enhancement, will further boosts its popularity - and apple #39;s profits.",3,"iod pus phot-viewing now it looks as if an additional functio, coupled with a definitely major enhancement, will further boosts its popularity - and aple #39;s profits.",2
"icing call out of money, out of patience, out of time, and for the foreseeable future, out of business.",2,"icing call out of oney, out of atience, out of time, and for th foreseeable fuure, out of busines.",3
"turkey unlikely to join eu before 2015: commissioner verheugen (afp) afp - turkey is unlikely to join the european union before 2015, eu enlargement commissioner guenter verheugen said in an interview.",2,"turkey unlikely to join eu before 015: commissioner verheuen (afp) afp - trkey is unlikely to join the european union before 2015, eu enlargement comissioner guenter verhugen said in an interview.",0
"indiana university suffers during peoplesoft rollout problems during the rollout of a peoplesoft financial aid software module at the indiana university system caused problems for about 3,000 students just as classes were set to start.",3,"indiana university suffers during peoplesoft rolout roblems during the rollou of a peoplesoft financial aid software mdule at the indiana university sytem caused problems for about 3,000 students just as classes were set to start.",2
"westwood up for challenge the course is a back-breaking 7,800 yards long off the tips, the rough is up, it #39;s 100f out there, the greens are fast and firm and refusing to hold, and yesterday there was a tricky wind to contend with.",1,"westwod p fr challeng the couse is a back-breaking 7,800 yards long off the tips, the rough is up, it #39;s 100f out there, the greens are fast and firm and refusing to hold, and yesterday there was a tricky wind to contend with.",2
"'dream team' out of gold race after loss to argentina  athens (reuters) - the u.s. men's basketball team was  beaten by argentina friday, denying it an olympic gold medal  for the first time since 1992 when nba players started  competing.",1,"'dream team' out o gold race after loss to argentina  athes (euters) - the u.s. men's basketball team was  beaten by argentina fridy, denying it an olympic gold medal  for the first time since 1992 when nba playrs started  competing.",0
"matsushita unveils dvd recorders, eyes higher share  tokyo (reuters) - panasonic brand products maker matsushita  electric industrial unveiled five new dvd recorders on  wednesday and said it was aiming to boost its share of the  domestic market to over 40 percent from around 35 percent.",3,"matsushita unveils dv ecorders, eyes higher share  tokyo (euters) - panasnic brand products maker matsushita  electric industrial unveiled five new dvd ecorders on  wednesday and said it was aiming to boost its share of the  domestic market to over 40 percent from around 35 percent.",2
"august chip sales up global semiconductor sales rose 1.1 percent to \$18.2 billion in august from the previous month and it appears as though chip inventories are declining, an industry trade group said thursday.",3,"august hip sales up global semiconductor sales rose 1.1 percent to \$18.2 billion in august from the previous month and it appears as though cip inventories are declining, an idustry trade group sid thursay.",2
"a check on bad banking habits are you used to getting a fat envelope from your bank with all your canceled checks? well, soon those checks may not be in the mail.",2,"a check on bad bnking habits are you used to getting a fat envelope from our ank with all yur cancele checks? well, soon those checks may not be in the mail.",3
"whitman: ebay to buy rent.com; compliments craigslist stake without reserve. ebay (nasdaq: ebay - news - people ) on friday said it is buying rent.com. the latter, which is privately held, provides online listings of apartment and house rentals.",3,"whitman: eba to buy rent.com; compliments cragslist stake without reserve. bay (nasdaq: eay - news - people ) on friday said it is buybuy renrentmcomhe latter, which is privately held, provides nline listings of apartment and house rentals.",2
"stock prices climb ahead of google ipo new york - investors shrugged off rising crude futures wednesday to capture well-priced shares, sending the nasdaq composite index up 1.6 percent ahead of google inc.'s much-anticipated initial public offering of stock.    in afternoon trading, the dow jones industrial average gained 67.10, or 0.7 percent, to 10,039.93...",0,"stock prices climb ahad of google ipo nw yor - inestors shugged off rising crude futures wednesday to capture well-priced shares, sending the nasdaq composite index up 1.6 percent ahead of google inc.'s much-anticipated initial public offering of stock.    in afternoon trading, the dow jones industrial average gained 67.10, or 0.7 percent, to 10,039.93...",2
"viacom, disney pay \$1.5m fcc fine disney and viacom agreed to a fine of \$1.5 million from the federal communications commission over claims their children #39;s cable television networks violated advertising restrictions, the fcc said thursday.",2,"viacom, disney py \$1.5m fcc fine disny and vacom agreed to a fine of \$1.5 million from the fderal communications commission over claims their children #39;s cable television networks violated advetising restrictions, the fcc said thursday.",3
photo: gap's gadget garment clothing retailer's new high-tech kids' fleece comes with a built-in radio.,3,phoo: gap's gadet garment clothing retailer' new high-teh kids' fleece coes with a built-in radio.,0
"tsa deal overpaid boeing, report says boeing co. received at least \$49 million in excessive profits on a \$1.2 billion contract to supply explosives-detection systems to hundreds of the nation #39;s airports, the department of homeland ",2,"tsa deal overpaid oeing, report says boeng co. received at least \$49 million in excessive proits on a \$1.2 billion contract to supply exploives-detection systems to hundreds of the nation #39;s airport, the department of homeland ",3
"unprecedented peril forces tough calls like the ""war on terrorism,"" which it often intersected, president bush's efforts against nuclear proliferation has followed many paths.",0,"unprecedented peril forcs tough calls like the ""ar on terrrism,"" which it often intersected, prsident bush's efforts against nclear proliferation has followed many paths.",3
"dutch mulling limits on freedom of expression many dutch decision-makers wondering whether reactions, particularly criticism of muslims, did not go too far. by isabelle wesselingh - the hague.",2,"dutch mulling limts on freedom o expression many dutc decision-akers wonderin whether reactions, particularly criticism of muslims, did not go too far. by isabelle wesselingh - the hague.",0
"lenovo confirms acquisition talks china #39;s largest manufacturer of personal computers lenovo group has confirmed it is in acquisition negotiations with a major information technology company, widely believed to be ibm.",2,"lenovo confirms acqusition tlks china #3;s largest maufacturer of persoal computers lenovo group has confirmed it is in acquisition negotiations with a major information technology company, widely believed to be ibm.",3
"space station crew become  quot;weightless-watchers quot; with low food &lt;b&gt;...&lt;/b&gt; with food supplies becoming critically low onboard the international space station, the astronauts have been told to cut back on their food consumption.",3,"sace station crew become  quot;weightess-watcher quot; with low food &lt;b&gt;...&lt;/b&gt; with food supplies becoming critically low onboard the international spce station, the astroauts have been told to cut back on their food consumption.",0
"bob evans, who helped i.b.m. transform data processing, dies at 77 bob o. evans led the development of a new class of mainframe computers - the famous 360's - helping turn i.b.m. into a data-processing power.",3,"bob evans, who helped i.b.m. transform data processing, dies at 77 bob o. evans led the development f a new class of manframe coputers - the famous 360's - helping turn i.b.m. into a dta-processing power.",2
"panera hopes 'chilling out' brews sales (ap) ap - bakery cafe chain panera bread co. hopes its customers will stick around a little longer  #151; grab a bite to eat, buy another cup of coffee, try the wi-fi. in other words, just chill out.",3,"panera hopes 'chilling out' brews sales (p) a - bakery cafe chain panera bread co. hohopests customers will stick around a little longer  #151; grab a bie to eat, buy another cup of coffee, try the i-i. in other words, just chill out.",2
"kerry pledges to create higher-paying jobs (ap) ap - john kerry headed to closely divided pennsylvania and wisconsin to tell voters he could produce better, higher-paying jobs from the white house than president bush has.",0,"kery pledges to create higher-paying jobs (p) p - john erry headed to closely divided pennsylvania and wisconsin to tell voters he could produce better, higher-paying jobs from the white house than president bush ha.",2
bush video awarded turner prize artist jeremy deller wins this year's turner prize for a film about us president george bush's home town.,0,ush video awarded turner prize artis jeremy deller ins this year's turner rize for a fim about us president george bush's home town.,3
"bt to buy infonet for us\$965mil berlin: bt group plc, britain #39;s largest phone company, plans to buy infonet services corp. for us\$965mil to add a data network spanning more than 180 countries.",2,"bt to buy infonet for us\$965mil berli: bbtgroup pc, britain #39;s largest phone company, plans totoybuyfinfonetrvices cor. for for$us5mil to add a data network spanning more than 180 countries.",3
"israel to close erez industrial zone before march israel would start liquidating the erez industrial zone in the northern gaza strip before launching the first stage of the disengagement plan in march 2005,local newspaper ha #39;aretz reported on tuesday.",0,"srael to cloe erez industrial zone before march isael would start liquidating the erez industrial zone in the northern gza strip before launching the first stage of tthedisengagement plan in march 2005,local newspaper ha #39;aretz reported on tusday.",2
"asian rust poses problem to area farmers david martz, like many other area farmers, just sighed upon hearing the news that asian soybean rust had been discovered in louisiana.",2,"asian rust poses problem to area farmers avid martz, like many other area frmers, just sighed upon hearig the news that asan oybean rust had been discovered in louisiana.",3
"man sets himself on fire near white house (ap) ap - a man set himself afire monday just outside a white house gate and repeatedly yelled ""allah allah"" as a secret service officer held him facedown on the sidewalk.",0,"man sets imself on fire near whte house (p) a - a man set himelf afire monday just outside a white house gate and repeatedly yelled ""allah allah"" as a secret service officer held him facedown on the sidewalk.",2
a new golden girl it took only 49.41 seconds for tonique williams-darling to etch her name in the annals of bahamian history. williams-darling crossed the finish line ,1,a new golden girl it tok only 49.41 econds for tonique willams-darling to etch her name in the annals of bahamian hisory. wiliams-darling crossed the finish line ,0
"blunkett gets tougher on drugs new police powers to prosecute offenders for possession if they test positive for drugs when they are arrested, even if the only drugs they have are in their bloodstream, are to be announced this week.",0,"blunkett gets tougher on drugs new police powers to rosecute offendrs for possession if the test positive for drus when they ae arrested, even if the only drugs they have are in their bloodstream, are to be announced this week.",1
apple to give its stores a mini me look the mac maker has big plans to expand its network of retail outlets by creating small versions of its stores.,3,aple to give its stores a mii me look the ma maker has big plans to expand its nework of retail outlets by creating small vrsions of its stores.,2
"microsoft plays up growth, dividend they were preaching to the choir, but bill gates and steve ballmer still did their best to sell the virtues of microsoft stock at the company #39;s annual shareholder meeting yesterday in bellevue.",3,"microsot plays up growth, dividend they were preaching to the choir, but bill ates and teve baller still did their best to sell the virtues of microsof stocktot the thepany #39;s annual shareholder meeting yesterday in bellevue.",2
"cingular sees merger savings above plan cingular wireless, the nation #39;s largest wireless carrier following the company #39;s merger with at amp;t wireless, said wednesday that it has completed integration activities ahead of schedule and now expects merger-related cost savings to exceed prior estimates ",2,"cingular sees merer savins above plan cingular wireless, the nation #3;s argest wireless carrier following the company #39;s merger with at mp;t wireless, said wednesday that it has completed integration activities ahead of schedule and now expects merger-related cost savings to exceed prior estimates ",3
"strong earthquake strikes central calif. parkfield, calif. - a strong earthquake struck central california on tuesday that was felt from san francisco to the los angeles area...",0,"strong earthqake stries central calif. parkfield, calif. - a strong erthquake struck ccentalcclifrnia on tuesday that was felt from san francisco to the los angeles area...",3
"news: us cracks down on spam mountain john ashcroft, the attorney general of the us, is expected to announce on thursday dozens of lawsuits against alleged spammers following a low key campaign against the practise across the us.\",3,"news: us crcks own o sam mountain john ashcroft, the attorney general of the us, is expected to announce on thursday dozens of lawsuits against alleged pammers following a low key campaign against the practise across the us.\",0
"linux security boost p2pnet.net news:- a european consortium, including linux-distributor mandrakesoft, has won an \$8.6 million contract to boost linux #39; security, says a techweb story, going on that the french ministry of defense is,  quot;expected to make the operating system ",3,"inux security boost p2pnet.net news:- a european consortium, including linu-distributor mandrakesoft, has won an \$8.6 million contract to boost lnux #39; secuity, says a techweb story, going on that the french ministry of defense is,  quot;expected to make the operating sysem ",2
"cloud rat arrives at london zoo london zoo celebrates the birth of a panay cloud rat, a very rare tree-living rodent from the philippines.",3,"cloud rat arrives at london zoo london zoo celebrates the birt of a panay cloud at, a ver raratree-liing rodent from the philippines.",0
"america's best airline? hawaiian airlines is putting up impressive numbers, including some that really matter to travelers.",2,"america's bet airlin? hawaiian arlines is ptting up impressive numbers, including some that realy matter to travelers.",0
this week in game news they risked hypothermia and fought off the effects of sleep deprivation so they could be among the first to achieve their quest in the wee hours of the morning.,3,this week in gae news they riske hypothermia and fought off the effect of leep deprivation so they could be among the first to achieve their uest in the wee hours of the morning.,0
"key australia-us fta deadline passes a key deadline to bring australia #39;s free trade agreement with the united states into force has expired. but the australian government is still confident the deal will come into effect next year, as louise willis reports.",2,"key australia-us fta deadline passes a key deadline to bring australia #39;s free trad agreement with the united states into force has exired. but the australian governmet s still confident he deal will come into effect next year, as louise willis reports.",0
"scientists try to save largest salamander (ap) ap - the population of north america's largest salamander is plummeting in missouri and arkansas, and scientists from five states met to consider how to prevent the creature's disappearance.",3,"scientits tr to sae largest salamander (ap) ap - the population of north america's largest salamander is plummeting in missouri and arkasas, and scientiss from five states met to consider how to prevent the creature's disappearance.",0
"informed and awaiting a st. helens eruption the people who remember the eruption of mount st. helens in 1980 are not as fearful as they were then, with scientists predicting a less powerful eruption.",3,"informed and awaiting a s. helen erption the people who remember the eruption of munt st. helens in 1980 are not as fearful as they were then, with scietists predicting a less powerful eruption.",0
