"politics an afterthought amid hurricane (ap) ap - if hurricane charley had struck three years ago, president bush's tour through the wreckage of this coastal city would have been just the sort of post-disaster visit that other presidents have made to the scenes of storms, earthquakes, floods and fires.",0,"plitics an afterthought amid hurricane (p) a - if hurricane charley had struck three years ago, preident bush's tour through the wreckage of this coastal city would have been just the sort of post-disaster visit that other presidents have made to the scenes of storms, earthquakes, floods and fire.",2
rugby: kiwis earn draw new zealand hold australia 16-16 in the first game of the 2004 tri-nations series.,0,ugby: kiwis earn draw new zealand hold ustralia 16-16 i the frst game of th 2004 tri-nations series.,1
on front line of aids in russia an industrial city northwest of moscow struggles as aids hits a broader population.,0,on front line f ads in rusia an industrial city northwest of mocow struggles as ids hits a broader population.,2
"clouds darken peoplesoft conference san francisco -- peoplesoft inc. is trying to create a party-like atmosphere at its annual customer conference, but this week's gathering may feel more like a wake with rival oracle corp.'s \$7.7 billion takeover bid looming larger than ever.",3,"clouds darken peoplesoft conference san franciso -- peoplesoft inc. i rying to create a party-like atmosphere at its annual custome conference, but this week's gatherig may feel more like a wake with rival oracle corp.'s \$7.7 billion takeover bid looming larger than ever.",2
"social security reform a boon for funds?  new york (reuters) - the bonanza many believe president  bush has handed the mutual fund industry with his plans to  reform social security may be a mirage, industry leaders said  on friday.",2,"social security reform a boon for fuds?  new yok (reuter) - the bonanza many believe president  bush has handed the mutual fnd industry with his plans to  reform social security ma be a mirage, industry leaders said  on friday.",0
"study raises stent doubts heart patients aren #39;t more likely to live long term after getting the artery-opening tubes called stents, according to a study released yesterday by researchers at duke university.",2,"study raiss stet doubts heart patients arn #9;t more likely to live long term after getting the artery-opening tubes called stents, according to a study released yesteday by researchers at duke university.",3
us got complaints about security guards the us state department wednesday noted  quot;aggressive quot; behavior by some dyncorp contractors hired to protect afghan president hamid karzai.,0,us got complaints about security guars the us state department wednesday noted  quot;aggressive quot; behavior by some dyncorp contractors hired o protect afgha president amid krzai.,2
"hamm not looking back controversial olympic gold medalist paul hamm is back in the united states and ready to move on. hamm, in worcester for the rock  amp; roll ",1,"ham not looking back controversal olympic gold medalist paul hamm is back n the nited states and ready to move on. hamm, in worceser for the rock  amp; roll ",0
"news: banks prepare for atm cyber crime an industry and law enforcement group hopes to prevent windows xp-based cash machines from inspiring ""the next wave of atm crime.""\",3,"news: banks prepare for atm cyer crime an industry and law enforcement group hopes to prevent widows x-based cash machines from inspiring ""the next wave of tm rime.""\",2
crowd inspires greek beach volleyballers; u.s. duo ousted  athens (reuters) - a roaring crowd helped inspire greece's  top women's beach volleyball team to trounce china on wednesday  and reach the next round.,0,crowd inspires greek beach volleyballers; u.s. du ousted  athns (reuters) - a roaring crowd helped inspire greece's  top women's bebeacholleyball team to trounc china on wednesday  and reach the next round.,1
"sia: chip sales to hit record, flatten worldwide semiconductor sales will hit an all-time high in 2004 but stay relatively flat in 2005 before climbing again over the next two years, according to the semiconductor industry association.",3,"si: hip sales to hit record, flatten worldwie semiconductor sales will hit an all-time high in 2004 but stay relatively flat in 2005 before climbing again over the next two years, acording t the semiconductor industry association.",2
malaysia expects to resume poultry exports to singapore soon by channel newsasia #39;s malaysia correspondent melissa goh. kuala lumpur : malaysia expects to resume export of poultry and eggs from two states to singapore by the end of this month but only after meeting conditions set by the island.,0,alaysia expects to resume poultry exports to singapore soon by channel newsasia #39;s malasia correspndent mlissa goh. kuala lumpur : malaysia expects to resume export of poultry and eggs from two states to singapore by the end of this month but only after meeting conditions set by the iland.,2
south korea #39;s lg claims development of media broadcasts-receiving &lt;b&gt;...&lt;/b&gt; seoul: south korea #39;s lg electronics inc announced that it has developed the world #39;s first mobile handset capable of receiving terrestrial digital multimedia broadcasts (dmb).,3,south korea #39;s lg claims development of media broadcasts-receiving &l;b&gt;...&t;/b&gt; seoul: south korea #39;s lg electronics inc announced that it has develoed the world #39;s first mobile handset capable of receiving terestrial digital multimedia broadcasts (mb).,2
"china vows currency shift but mum on date washington, oct. 2: in the face of growing international pressure, chinese officials told top us officials on friday that they would continue to push ahead with plans to float or revalue their currency, but ",2,"china vows urrency shift but mum on date ashington, ot. 2: in the face of growing international pressre, chinese officias told top us officials on friday that they would continue to push ahead with plans to float or revalue their currency, but ",0
scientists to study dairy going organic (ap) ap - cornell researchers will watch five upstate new york dairy herds to learn about the problems and challenges of converting from conventional to organic farming.,3,scientist to study dairy going organic (a) p - corell researchrs will watch five upstate new york dairy herds to learn about the problems and challenges of converting from conventional to organic farming.,2
"mccain again opposes the president global warming needs more attention, according to john mccain, and president bush needs to lead the way. i listened to some of the hearings on this subject this week, and i must say the people testifying are ",0,"mccan again oppses the presidnt global warming eeds more attention, according to john mccain, and president bush needs to lead the way. i listened to some of the hearings on this subject this week, and i must say the people testifying ar ",3
gray was selected tourney mvp justin gray went down to the madison square garden court as soon as mustafa shakur inadvertently kicked him in the face while going for a loose ball.,1,gray was selcted tourney vp ustin gray went down to the madison square garden court as soo as mustafa shakur inadvertently kicked him in the face while going for a loose bll.,0
"short jump, bad handoff end jones #39; games athens, greece - for marion jones, sydney must seem far more than half a world away. those olympics were some dreamland where she ruled track and field with a golden touch and a sweet smile, winning five medals ",1,"short jump, bad handoff end jones #9; games athens, greece - for marion jones, sydny must seem far more than half a world awy. hose olympics were some dreamland where sh ruled track and field with a golden touch and a sweet smile, winning five medals ",0
"gm protests spread across europe tens of thousands of general motors workers across europe were set to stop working on tuesday in a sign of solidarity with their german colleagues, who face massive job cuts.",0,"gm protests sprad across erope tens of thousands of general motors workers across eurpe were set to stop working on tuesday in a sign of solidarity with their germa colleaues, who face massive job cuts.",2
eu to talk through asylum plans key eu interior ministers are to meet in florence to discuss plans for migrant holding centres outside europe.,0,e to talk through asyum plans key eu interior miniters are to meet in florence to discuss plans for migrant holiin centres outside erope.,3
pires unfazed by france exclusion robert pires admits his current form does not merit inclusion in the french national side but has made it clear he has no plans to retire from international football.,1,pire unfazed b france exclusion robert ires admits his current form does not meit inclusion in the french national side but has made it clear he has no plans to retire from international footbll.,0
canada defends submarine fleet canada has defended its decision to buy second-hand submarines after a crewman died from injuries sustained on one of the vessels that had broken down.,0,cnada defends sumarine fleet canada has defended its decision t buy second-hand submarnes after a crwman died from injuries sustained on one of the vessels that had broken down.,2
"cingular planning major 3g wireless rollout just as the at amp;t buy helped cingular move ahead of verizon wireless to the top of the industry in terms of size, the new network would likely give it an overall faster network, a distinction most say verizon can now boast.",3,"cingular planning major 3g wireless ollout just as the at amp;t buy helped cingular move ahead of verizon wireless to the top of the industry in terms of size, the new network would likely give it an overall faster network, a distinction ost sa verizon cn now bost.",2
oracle profit rises on software demand  san francisco (reuters) - oracle corp. on tuesday reported  a higher quarterly profit as the world's second largest  software company benefited from steady demand for its flagship  database software.,2,oracle profit rise on software demand  sa fracisco (reuters) - oracle crp. on tuesday reported  a higher quaterly profit as the world's second largest  software company benefited from steady demand for its flagship  database software.,3
"the bag of aeolus  quot;aeolus was keeper of the winds. he gave a bag of evil winds to odysseus, instructing him to keep it closed while a good breeze wafted him home.",1,"the bag of aeolus  quot;aeolus was keeper of the winds. e gave a bbagoofevil winds to odysseus, instructing hi ttokeep it closed while a ood breez wafted hi home.",3
eu set to launch 'transit camps' eu ministers agree to set up five pilot reception centres in africa to process asylum applications.,0,e set to launch 'transit camps' e minisers agree to set up five pilot reception centres in afrca to process aylum applications.,3
"intel drops prices on computer chips san francisco - intel corp. has cut prices on its computer chips by as much as 35 percent, though analysts on monday said the cuts were probably unrelated to swelling inventories of the world #39;s largest chip maker.",2,"intel drops prices n omputer chips san francisco - intel corp. has cut prices on its computer chips by as much as 35 percent, though analyts on monday said the cuts were probably unrelated to swelling inventories of the world #39;s largst chip mker.",3
"hundreds mourn loss of student killed by police during red sox &lt;b&gt;...&lt;/b&gt; as hundreds of mourners paid their final respects tuesday to victoria snelgrove, her pastor denounced the raucous fans who prompted police to fire the pepper-spray pellet that killed the college student.",1,"hundreds mourn loss of student killed by police during rd so &lt;b&gt;...&lt;/b&t; as hundreds of mourners paid their final respects tuesday to victoria snelgrove, her pastor denounced the raucous fas who prompted police to fire the pepper-spray pellet that killed the college student.",0
"data view: hk exports slow in july, but momentum intact hong kong (dow jones)--hong kong #39;s export expansion slowed a touch in july, as expected, but still continued at double-digit rates thanks to high trade volume with mainland china.",2,"data vew: hk exprts low in uly, but momentum intact hong kong (dow jones)--hong kong #39;s export expnsion slowed a touch in july, as expected, but still continued at double-digit rates thanks to high trade volume with mainland china.",0
sandia motor speedway for sale on ebay (ap) ap - and the race is off! only 29 days and some odd hours left to place your bid on ebay to buy the sandia motor speedway.,3,sandia motor speedway for sae on eba (p) ap - and the race is off! only 29 days and some odd hours left to place your bid on eba to buy the sandia motr speedway.,1
"photo gallery: bill gates' home on lake washington webshots users offer their photos of bill gates mansion in medina, wash.",3,"phot gallery: bill gates' home on lak washington webshots user ffer their photos of bilbillte mansion in medina, wash.",0
"net firms: don't tax voip the spanish-american war is over and a ""temporary"" tax created to pay for it should not be extended to internet phone calls, industry groups tell the irs",3,"net firms: don't tax oip the spanish-american war is over and a ""temporary"" tax ceated t pay fr it should not be extended to iternet phone calls, industry groups tell the irs",2
"flying taxis -  quot;within five years quot; british company avcen, designers of  quot;jetpod quot; taxi, believe they can offer a flying taxi service within 5 years. the taxi, due to undergo  quot;proof of concept quot; test flights over the next 18 months, cruises to 228m with speeds of up to 350 mph (563 kph).",3,"flying taxis -  qot;within five years qut; ritish company avcen, designers of  quot;jetpod qut; taxi, believe they can offer a flyiflyingi service within 5 years. the taxi, due to undergo  quot;proof ooconcept qquot test flights over the next 18 months, cruises to 228m with speeds of up to 350 mph (563 kph).",2
first look: intuit's quickbooks for newbies new simple start edition accounting software targets small businesses still using pencil and paper.,3,firs loo: intuit's quickbooks for newbies new smple start dition accounting softare targets small businesses still using pencil and paper.,2
"strikes at london airports london - a 48-hour strike by aircraft refuellers at london heathrow airport got under way on friday, with baggage handlers at gatwick airport also preparing to walk out, threatening a weekend of travel disruptions.",2,"strikes at london arports london - a 8-our stike by aircraft refuellers at london heathrow airport got under way on friday, with baggae handlers at gatwick airport also preparing to walk out, threatening a weekend of travel disruptions.",0
"us star slams sweet-rustlin', phone beepin' theatre crowd (afp) afp - kevin spacey, the us screen star who is spending a season working for one of london's top west end theatres, lashed out at members of the audience who rustle sweet wrappers and forget to turn off their mobile phones during performances.",0,"us tar sams sweet-rustlin', phone beepin' theatre crowd (af) ap - kevin spacey, the us screen sar who is spending a season working for one of london's top west end theatres, lashed out at members of the audience who rustle swesweetappers and forget to turn off their mobile phophoneuring performances.",3
clarke takes charge of blunkett's fear agenda &lt;strong&gt;analysis&lt;/strong&gt; horizontal drinkers rejoice,3,clarke takes charge of blunkett's fear agenda &t;strong&g;analysi&l;/strong&g; horizontal drinkers rejoice,1
britons still prefer fish n'chips (afp) afp - traditional fish-and-chips along with cherished pub grub remain the dishes of choice for britons outstripping chinese or indian take-aways.,0,britons still prefer fish n'chips (fp) ap - traditional fifishd-chips along with cherished pu grub remain the dishes of choice for briton outstripping chinese or indian take-aways.,3
civil servants in net porn probe more than 200 staff at the department of work and pensions have been disciplined for downloading porn at work.,3,civil servants in ne orn probe more than 200 saff at the department of work and pensions have been disciplined for downloding pon at work.,2
"it seeing steady but slow growth: forrester projects 7 percent &lt;b&gt;...&lt;/b&gt; tech companies waiting for a big resurgence in spending on computer hardware, software, networks and staff better plan to wait about four more years, forrester research projected yesterday.",2,"it seeing steady but slow growt: forrster projects 7 percent &lt;b&gt;...&lt;/b&g; tech companies waiting for a big resurgence in spending on computer hardware, software, networks and staff better plan to wait about four more years, forrester research projected yesterday.",3
"cubs plate three runs in ninth inning, fall a run short the chicago cubs need more than rally caps, good-luck charms or curse-busters now. mike hampton and dewayne wise each hit two-run homers to lead the atlanta braves to ",1,"cubs plate three runs in ninth inning, fal a run short the chicago cubs need more than rally caps, good-luck chams r curse-busters nw. mike hampton and dewayne wise each hit two-run homers to lead the atlanta braves o ",0
"india's tata makes powerful debut shares  in indian software services giant tata consultancy close 16 higher on their market debut, raising \$1.2bn for the company.",2,"india's tta makes powerful debut shars  in ndian software services gian tata consultancy close 16 higher on their market debut, raising \$1.2b for the company.",3
"chirac: europe can do more in science race (ap) ap - a european laboratory that was the birthplace of the world wide web and home of nobel prize-winning developments in understanding the origins of the universe celebrated its 50th birthday tuesday. but french president jacques chirac warned that despite those illustrious achievements, european scientists are falling behind.",3,"chirac: europe can do more in science race (ap) p - a european aboratory that was the birthplace of the world wide we and home of nobel prize-winning developments in understanding the origins of the univers celebrated its 50th birthday tuesday. but french president jacques chirac warned that despite those illustrious achievements, european scientiss are falling behind.",0
"henman sails at the swiss indoors &lt;p&gt;&lt;/p&gt;&lt;p&gt; by mark ledsom&lt;/p&gt;&lt;p&gt; basel (reuters) - britain's world number four tim henmanwon his opening match at the swiss indoors tennis tournamentwith little difficulty on wednesday, beating frenchman antonydupuis 6-3, 6-4.&lt;/p&gt;",0,"henman sails at the swiss indoors &lt;p&gt;&lt;/p&gt;&lt;p&gt; by mark ledsom&lt;/p&gt;&lt;p&g; basel (reuter) - britain's world number four tim henmanwon his opening match at the swiss indoors tennis tournamentwith little difficulty on wednesday, beating frenchman antonydupuis 6-3, 6-4.&lt;/p&t;",1
"milosevic #39;s lawyers to appeal own appointment the hague, netherlands -- the two lawyers representing slobodan milosevic filed papers thursday (9 september), asking for permission to appeal their appointment by the un tribunal.",0,"miloseic #39;s lawyers to appeal own appointment the ague, ntherlands -- the two lawyers representing sloboan miloseic filed papers thursday (9 september), asking for permission to appeal their appointment by the un tribunal.",2
job-loss panic rises in western europe (ap) ap - stephane zervos first suspected his job was threatened when his bosses removed most of the heavy equipment from the car wheel factory where he'd worked for 24 years.,0,job-loss panic ries in western europ (ap) ap - stephane zervos first suspected hi job was threatened when hs bosses removed most of the heavy equipment from the car wheel fatory where he'd worked for 24 years.,3
"florida weather may help israeli citrus industry as sunshine state licks its wounds from hurricane frances, gan shmuel could reap the benefits. the most important news for florida #39;s 2.8 million residents this week has not been from the republican ",2,"florida weather ma help israeli citrs idustry as sunshine state licks its wounds from hurricane franes, gan shmuel could reap the benefts. the most important news for florida #39;s 2.8 million residents this week has not been from the republican ",0
"without batting an eyelash : a very french welcome for a new &lt;b&gt;...&lt;/b&gt; that night, it seemed as if three or four parties were going on at once in cosmo manille. wrong, palanggas. actually, there were five in makati alone, and one of them had a stream of traffic ",1,"without battin an eyelash : a very frenh welcome for a new &lt;b&t;...&lt;/b&t; that night, it seemed as if three or four parties were going on at once in cosmo manille. wrong, palanggas. actually, there were five in makati alone, andanne of them had a stream of traffic ",0
"plane repos ready to take flight at the airport, you hear all of the usual explanations: bad weather, mechanical difficulties, no crew available. but now there #39;s another excuse you might hear as times get tougher for cash ",3,"plane repos ready to take flight at the airport, you hear all of the usual explanatons: bad wether, mechanica difficulties, no cew available. but now there #39;s anther excuse you might hear as times get tougher for cash ",2
"jjb profit and bid hopes fade away sports retailer jjb yesterday reported a near 25 drop in profits and continuing poor sales, and ended shareholders #39; hopes of a takeover by announcing that a potential bidder had walked away.",2,"jjb profit and bid hopes fade away sports etailer jjb yeterday reported a near 25 drop in proits and continuing poor sales, and ended shareholders #39; hopes of a takeover by announcing that a potential bidder had walked awy.",1
particle lab celebrates 50th birthday the european research facility which helped shape our view of matter and invented the world wide web is exactly 50 years old.,3,particl la celebrates 50th birthday th european reseach facility which helped shape our view of matter and invented the world wide wb is exactly 50 years old.,0
"china, argentina sign 5 cooperation documents china and argentina signed five agreements in buenos aires tuesday that will allow them to expand cooperation in the areas of trade, space, education, tourism and railways.",2,"china, argentina ign 5 cooperation documents china and argentina signed five agreements in buenos aires tueday tha will allow them to expand cooperation in the areas of tade, space, education, torism and railways.",0
"inspector google solves the crime it #39;s normally employed to drum up that missing address, phone number or website, or to check facts, dates, names and other miscellany.",3,"inspector googl solves the crime it #39;s normally employed to drum up that missing address, phoe number or wbsite, or to check facts, dates, naes and other miscellany.",2
"flu shot shortage highlights u.s. crisis  washington (reuters) - concerned health officials began  investigating on friday what went wrong at a british vaccine  plant where half the u.s. flu shots were made, and called on  more companies to get into the vaccine business.",0,"flu shot shortage hghlights u.s. crsis  washington (reuters) - concened health officials began  investigating on friday what went wrong at a british vaccine  plant where half the u.s. flu shots were made, and called on  more companies to get into the vaccine business.",2
"bonds takes stock the distraction of another milestone is gone, and bonds is preparing himself to play every game for the rest of the season.",1,"bonds tkes stock the distracion of another miletone s gone, and bonds is preparing himself to play every gam for the rest of the season.",2
"\$78,000 for a cane that helped a legend walk the line many of johnny cash's possessions were sold at sotheby's, collecting \$3,984,260 for the cash family, more than double the pre-auction estimate.",2,"\$78,000 for a cane that helped a legend wak the line many of johnny cash's possessions were sold at sotheby's, collecting \$3,984,260 fforthe csh family, more than double the pr-aucion estimat.aa",0
"top us spammer is bound for the slammer washington - a man convicted of violating anti-spam laws by sending out tens of thousands of unsolicited emails using fake addresses faces nine years in prison in virginia, authorities said on thursday.",3,"top us spammer is bound for the slammer washington - a man convicted of violating anti-spm laws by sending out tens of thousands of unsolicited emais using fae addresse faces nin years in prison in virginia, authorities said on thursday.",2
"will your phone become your credit card? motorola is working with mastercard to introduce a ""lifestyle changing"" credit card phone by year's end.",3,"will your pone become your credit crd? motoola is working with mastercard to introdue a ""lifestyle changing"" credit card phone by year' end.",2
sc to hear zee petition tommorrow five judges of the top court will hear a petition filed by zee telefilms on tuesday. a three-judge panel of the supreme court said a five-judge bench would hear the dispute that threatens the rights of india #39;s ,0,s to hear zee petition tommorrow five judges of the top court will hear a petition filed by ze teleilms on tuesday. a three-judge panel of the supreme court said a five-judge bench would hear the dispute that threaens the rights of inda #39;s ,3
